{
  "$schema": "https://json-schema.org/draft/2020-12/schema",
  "title": "Add project",
  "type": "object",
  "required": [
    "id",
    "slug",
    "title",
    "status",
    "organizationIds",
    "contributors",
    "evidenceRefs"
  ],
  "properties": {
    "id": {
      "type": "string",
      "pattern": "^project:"
    },
    "slug": {
      "type": "string",
      "pattern": "^[a-z0-9][a-z0-9-]*$"
    },
    "title": {
      "type": "object",
      "minProperties": 1,
      "properties": {
        "zh": {
          "type": "string",
          "minLength": 1
        },
        "en": {
          "type": "string",
          "minLength": 1
        }
      },
      "additionalProperties": false
    },
    "status": {
      "type": "string"
    },
    "category": {
      "type": "string"
    },
    "organizationIds": {
      "type": "array",
      "items": {
        "type": "string",
        "pattern": "^org:"
      }
    },
    "contributors": {
      "type": "array",
      "items": {
        "type": "object",
        "required": [
          "displayName",
          "role",
          "order"
        ],
        "properties": {
          "displayName": {
            "type": "string",
            "minLength": 1
          },
          "role": {
            "type": "string"
          },
          "order": {
            "type": "integer",
            "minimum": 1
          },
          "externalUrl": {
            "type": [
              "string",
              "null"
            ]
          }
        },
        "additionalProperties": false
      }
    },
    "evidenceRefs": {
      "type": "array",
      "minItems": 1,
      "items": {
        "type": "string",
        "pattern": "^evidence:"
      }
    },
    "verifiedAt": {
      "type": "string"
    }
  },
  "additionalProperties": false
}
